{
  "schema": "anchor",
  "id": "anchor-15",
  "act": 2,
  "title": "Breach of Contract",
  "capacity_mw": 260,
  "starting_funds": 2210,
  "lives": 21,
  "grid": {
    "w": 17,
    "h": 13
  },
  "path": [
    [
      0,
      6
    ],
    [
      8,
      6
    ],
    [
      8,
      2
    ],
    [
      15,
      2
    ],
    [
      15,
      10
    ],
    [
      2,
      10
    ],
    [
      2,
      12
    ]
  ],
  "slots": [
    [
      3,
      4
    ],
    [
      6,
      4
    ],
    [
      11,
      0
    ],
    [
      11,
      4
    ],
    [
      13,
      6
    ],
    [
      0,
      8
    ],
    [
      5,
      8
    ],
    [
      10,
      8
    ],
    [
      5,
      12
    ],
    [
      9,
      12
    ],
    [
      13,
      12
    ]
  ],
  "waves": [
    {
      "lead_in": 20,
      "spawns": [
        {
          "enemy": "reach-picket",
          "count": 4,
          "interval": 0.7
        },
        {
          "enemy": "warden-drone",
          "count": 2,
          "interval": 1.05
        },
        {
          "enemy": "reach-sapper",
          "count": 1,
          "interval": 2.2,
          "delay": 6
        },
        {
          "enemy": "reach-breacher",
          "count": 1,
          "interval": 5.0,
          "delay": 10
        }
      ]
    },
    {
      "lead_in": 16,
      "spawns": [
        {
          "enemy": "reach-picket",
          "count": 8,
          "interval": 0.7
        },
        {
          "enemy": "warden-drone",
          "count": 2,
          "interval": 1.0
        },
        {
          "enemy": "reach-skiff",
          "count": 1,
          "interval": 1.8,
          "delay": 5
        },
        {
          "enemy": "reach-sapper",
          "count": 1,
          "interval": 2.0,
          "delay": 7
        },
        {
          "enemy": "reach-bulwark",
          "count": 1,
          "interval": 7.0,
          "delay": 12
        }
      ]
    },
    {
      "lead_in": 16,
      "spawns": [
        {
          "enemy": "reach-picket",
          "count": 7,
          "interval": 0.7
        },
        {
          "enemy": "warden-mote",
          "count": 1,
          "interval": 1.3,
          "delay": 4
        },
        {
          "enemy": "warden-drone",
          "count": 1,
          "interval": 1.0
        },
        {
          "enemy": "reach-sapper",
          "count": 1,
          "interval": 2.0,
          "delay": 6
        },
        {
          "enemy": "reach-breacher",
          "count": 1,
          "interval": 4.5,
          "delay": 9
        }
      ]
    },
    {
      "lead_in": 15,
      "spawns": [
        {
          "enemy": "reach-picket",
          "count": 10,
          "interval": 0.7
        },
        {
          "enemy": "warden-drone",
          "count": 2,
          "interval": 0.95
        },
        {
          "enemy": "reach-skiff",
          "count": 2,
          "interval": 1.7,
          "delay": 5
        },
        {
          "enemy": "reach-sapper",
          "count": 2,
          "interval": 1.9,
          "delay": 6
        },
        {
          "enemy": "reach-bulwark",
          "count": 1,
          "interval": 7.0,
          "delay": 11
        }
      ]
    },
    {
      "lead_in": 15,
      "spawns": [
        {
          "enemy": "reach-picket",
          "count": 8,
          "interval": 0.7
        },
        {
          "enemy": "warden-drone",
          "count": 3,
          "interval": 0.95
        },
        {
          "enemy": "warden-heavy",
          "count": 1,
          "interval": 4.0,
          "delay": 6
        },
        {
          "enemy": "warden-mote",
          "count": 2,
          "interval": 1.25,
          "delay": 4
        },
        {
          "enemy": "reach-sapper",
          "count": 2,
          "interval": 1.8,
          "delay": 6
        },
        {
          "enemy": "reach-breacher",
          "count": 1,
          "interval": 4.5,
          "delay": 9
        }
      ]
    },
    {
      "lead_in": 14,
      "spawns": [
        {
          "enemy": "reach-picket",
          "count": 11,
          "interval": 0.7
        },
        {
          "enemy": "warden-drone",
          "count": 3,
          "interval": 0.9
        },
        {
          "enemy": "reach-skiff",
          "count": 2,
          "interval": 1.6,
          "delay": 5
        },
        {
          "enemy": "reach-sapper",
          "count": 3,
          "interval": 1.7,
          "delay": 6
        },
        {
          "enemy": "reach-bulwark",
          "count": 1,
          "interval": 6.0,
          "delay": 10
        }
      ]
    },
    {
      "lead_in": 14,
      "spawns": [
        {
          "enemy": "reach-picket",
          "count": 15,
          "interval": 0.7
        },
        {
          "enemy": "warden-drone",
          "count": 2,
          "interval": 0.9
        },
        {
          "enemy": "warden-mote",
          "count": 1,
          "interval": 1.2,
          "delay": 4
        },
        {
          "enemy": "reach-skiff",
          "count": 2,
          "interval": 1.5,
          "delay": 5
        },
        {
          "enemy": "reach-sapper",
          "count": 2,
          "interval": 1.6,
          "delay": 6
        },
        {
          "enemy": "reach-breacher",
          "count": 1,
          "interval": 4.0,
          "delay": 9
        }
      ]
    },
    {
      "lead_in": 13,
      "spawns": [
        {
          "enemy": "reach-picket",
          "count": 15,
          "interval": 0.7
        },
        {
          "enemy": "warden-drone",
          "count": 4,
          "interval": 0.85
        },
        {
          "enemy": "warden-heavy",
          "count": 1,
          "interval": 3.5,
          "delay": 5
        },
        {
          "enemy": "reach-skiff",
          "count": 3,
          "interval": 1.5,
          "delay": 5
        },
        {
          "enemy": "reach-sapper",
          "count": 3,
          "interval": 1.6,
          "delay": 6
        },
        {
          "enemy": "reach-bulwark",
          "count": 1,
          "interval": 6.0,
          "delay": 10
        }
      ]
    },
    {
      "lead_in": 13,
      "spawns": [
        {
          "enemy": "reach-picket",
          "count": 14,
          "interval": 0.7
        },
        {
          "enemy": "warden-drone",
          "count": 3,
          "interval": 0.85
        },
        {
          "enemy": "warden-heavy",
          "count": 1,
          "interval": 3.5,
          "delay": 5
        },
        {
          "enemy": "warden-mote",
          "count": 2,
          "interval": 1.15,
          "delay": 4
        },
        {
          "enemy": "reach-skiff",
          "count": 3,
          "interval": 1.4,
          "delay": 5
        },
        {
          "enemy": "reach-sapper",
          "count": 3,
          "interval": 1.5,
          "delay": 6
        },
        {
          "enemy": "reach-breacher",
          "count": 1,
          "interval": 4.0,
          "delay": 8
        },
        {
          "enemy": "reach-bulwark",
          "count": 1,
          "interval": 6.0,
          "delay": 12
        }
      ]
    }
  ]
}
