{
  "schema": "anchor",
  "id": "anchor-02",
  "act": 1,
  "title": "Line of Sight",
  "capacity_mw": 80,
  "starting_funds": 460,
  "lives": 10,
  "grid": {
    "w": 15,
    "h": 11
  },
  "path": [
    [
      0,
      6
    ],
    [
      4,
      6
    ],
    [
      4,
      2
    ],
    [
      8,
      2
    ],
    [
      8,
      8
    ],
    [
      12,
      8
    ],
    [
      12,
      4
    ],
    [
      14,
      4
    ]
  ],
  "slots": [
    [
      2,
      4
    ],
    [
      2,
      8
    ],
    [
      6,
      0
    ],
    [
      6,
      4
    ],
    [
      10,
      2
    ],
    [
      10,
      6
    ],
    [
      13,
      2
    ],
    [
      13,
      6
    ],
    [
      9,
      10
    ]
  ],
  "waves": [
    {
      "lead_in": 22,
      "spawns": [
        {
          "enemy": "warden-drone",
          "count": 6,
          "interval": 1.7
        }
      ]
    },
    {
      "lead_in": 18,
      "spawns": [
        {
          "enemy": "warden-drone",
          "count": 8,
          "interval": 1.5
        },
        {
          "enemy": "warden-mote",
          "count": 3,
          "interval": 2.4,
          "delay": 6
        }
      ]
    },
    {
      "lead_in": 16,
      "spawns": [
        {
          "enemy": "warden-drone",
          "count": 10,
          "interval": 1.4
        },
        {
          "enemy": "warden-mote",
          "count": 4,
          "interval": 2.1,
          "delay": 5
        }
      ]
    },
    {
      "lead_in": 16,
      "spawns": [
        {
          "enemy": "warden-drone",
          "count": 11,
          "interval": 1.3
        },
        {
          "enemy": "warden-mote",
          "count": 5,
          "interval": 1.9,
          "delay": 5
        }
      ]
    },
    {
      "lead_in": 15,
      "spawns": [
        {
          "enemy": "warden-drone",
          "count": 13,
          "interval": 1.2
        },
        {
          "enemy": "warden-mote",
          "count": 7,
          "interval": 1.6,
          "delay": 4
        }
      ]
    },
    {
      "lead_in": 14,
      "spawns": [
        {
          "enemy": "warden-drone",
          "count": 15,
          "interval": 1.1
        },
        {
          "enemy": "warden-mote",
          "count": 9,
          "interval": 1.4,
          "delay": 4
        }
      ]
    },
    {
      "lead_in": 12,
      "spawns": [
        {
          "enemy": "warden-drone",
          "count": 18,
          "interval": 1.0
        },
        {
          "enemy": "warden-mote",
          "count": 11,
          "interval": 1.2,
          "delay": 3
        }
      ]
    }
  ]
}
