{
  "schema": "anchor",
  "id": "anchor-12",
  "act": 2,
  "title": "Asset Recovery",
  "capacity_mw": 150,
  "starting_funds": 1250,
  "lives": 12,
  "grid": {
    "w": 16,
    "h": 12
  },
  "path": [
    [
      0,
      2
    ],
    [
      13,
      2
    ],
    [
      13,
      6
    ],
    [
      2,
      6
    ],
    [
      2,
      9
    ],
    [
      15,
      9
    ]
  ],
  "slots": [
    [
      0,
      4
    ],
    [
      4,
      4
    ],
    [
      8,
      4
    ],
    [
      11,
      4
    ],
    [
      15,
      4
    ],
    [
      5,
      8
    ],
    [
      9,
      8
    ],
    [
      12,
      8
    ],
    [
      5,
      11
    ],
    [
      9,
      11
    ],
    [
      13,
      11
    ]
  ],
  "waves": [
    {
      "lead_in": 20,
      "spawns": [
        {
          "enemy": "warden-drone",
          "count": 4,
          "interval": 1.15
        },
        {
          "enemy": "reach-sapper",
          "count": 2,
          "interval": 2.8,
          "delay": 7
        }
      ]
    },
    {
      "lead_in": 17,
      "spawns": [
        {
          "enemy": "warden-drone",
          "count": 4,
          "interval": 1.1
        },
        {
          "enemy": "reach-skiff",
          "count": 2,
          "interval": 2.1,
          "delay": 6
        },
        {
          "enemy": "reach-sapper",
          "count": 2,
          "interval": 2.6,
          "delay": 8
        }
      ]
    },
    {
      "lead_in": 16,
      "spawns": [
        {
          "enemy": "warden-mote",
          "count": 2,
          "interval": 1.5,
          "delay": 4
        },
        {
          "enemy": "warden-drone",
          "count": 4,
          "interval": 1.1
        },
        {
          "enemy": "reach-sapper",
          "count": 2,
          "interval": 2.5,
          "delay": 7
        },
        {
          "enemy": "reach-breacher",
          "count": 1,
          "interval": 6.0,
          "delay": 11
        }
      ]
    },
    {
      "lead_in": 16,
      "spawns": [
        {
          "enemy": "warden-drone",
          "count": 4,
          "interval": 1.05
        },
        {
          "enemy": "reach-skiff",
          "count": 2,
          "interval": 1.9,
          "delay": 5
        },
        {
          "enemy": "reach-sapper",
          "count": 2,
          "interval": 2.3,
          "delay": 7
        },
        {
          "enemy": "reach-breacher",
          "count": 1,
          "interval": 5.5,
          "delay": 10
        }
      ]
    },
    {
      "lead_in": 15,
      "spawns": [
        {
          "enemy": "warden-drone",
          "count": 5,
          "interval": 1.0
        },
        {
          "enemy": "warden-mote",
          "count": 3,
          "interval": 1.4,
          "delay": 4
        },
        {
          "enemy": "reach-sapper",
          "count": 3,
          "interval": 2.2,
          "delay": 7
        },
        {
          "enemy": "reach-breacher",
          "count": 1,
          "interval": 5.5,
          "delay": 10
        }
      ]
    },
    {
      "lead_in": 15,
      "spawns": [
        {
          "enemy": "warden-drone",
          "count": 5,
          "interval": 1.0
        },
        {
          "enemy": "warden-heavy",
          "count": 1,
          "interval": 4.5,
          "delay": 6
        },
        {
          "enemy": "reach-skiff",
          "count": 3,
          "interval": 1.8,
          "delay": 5
        },
        {
          "enemy": "reach-sapper",
          "count": 3,
          "interval": 2.0,
          "delay": 7
        },
        {
          "enemy": "reach-breacher",
          "count": 1,
          "interval": 5.0,
          "delay": 9
        }
      ]
    },
    {
      "lead_in": 14,
      "spawns": [
        {
          "enemy": "warden-drone",
          "count": 5,
          "interval": 0.95
        },
        {
          "enemy": "warden-mote",
          "count": 3,
          "interval": 1.3,
          "delay": 4
        },
        {
          "enemy": "reach-skiff",
          "count": 3,
          "interval": 1.7,
          "delay": 5
        },
        {
          "enemy": "reach-sapper",
          "count": 4,
          "interval": 1.9,
          "delay": 7
        },
        {
          "enemy": "reach-breacher",
          "count": 1,
          "interval": 5.0,
          "delay": 9
        }
      ]
    },
    {
      "lead_in": 13,
      "spawns": [
        {
          "enemy": "warden-drone",
          "count": 5,
          "interval": 0.9
        },
        {
          "enemy": "warden-heavy",
          "count": 1,
          "interval": 4.0,
          "delay": 6
        },
        {
          "enemy": "reach-skiff",
          "count": 4,
          "interval": 1.6,
          "delay": 5
        },
        {
          "enemy": "reach-sapper",
          "count": 4,
          "interval": 1.8,
          "delay": 7
        },
        {
          "enemy": "reach-breacher",
          "count": 2,
          "interval": 4.5,
          "delay": 9
        }
      ]
    }
  ]
}
